{
  "schema_version": "1.0.0",
  "as_of": "2026-09-26",
  "categories": [
    {
      "code": "entry",
      "title": "Подготовка к въезду, образование и виза",
      "step_ids": [
        "FED_ENTRY_RULE_CHECK",
        "FED_INVITATION_REQUEST",
        "FED_VISA_APPLY",
        "FED_VISA_COLLECT_ABROAD",
        "FED_EDU_RECOGNITION_CHECK",
        "FED_EDU_RECOGNITION_APPLY",
        "FED_RUID_STANDARD",
        "FED_RUID_EMERGENCY",
        "FED_MIGRATION_CARD_ENTRY"
      ]
    },
    {
      "code": "accounting",
      "title": "Миграционный учёт и адрес проживания",
      "step_ids": [
        "FED_HOST_DOCUMENTS",
        "FED_REGISTRATION_CONFIRMATION",
        "FED_HOTEL_IDENTIFY",
        "FED_SELF_ARRIVAL_NOTICE",
        "FED_RESIDENCE_REGISTER",
        "FED_REGISTRATION_DUPLICATE",
        "FED_ACCOUNTING_DATA_UPDATE"
      ]
    },
    {
      "code": "stay_status",
      "title": "Продление пребывания и статусы РВП/РВПО/ВНЖ",
      "step_ids": [
        "FED_STAY_PETITION_REQUEST",
        "FED_STUDY_VISA_EXTEND",
        "FED_STUDY_VISA_COLLECT",
        "FED_RVPO_APPLY",
        "FED_RVP_APPLY",
        "FED_VNH_APPLY",
        "FED_VNH_ANNUAL_NOTICE",
        "FED_RVP_ANNUAL_NOTICE"
      ]
    },
    {
      "code": "health",
      "title": "Медицина, дактилоскопия и страхование",
      "step_ids": [
        "FED_MEDICAL_INITIAL",
        "FED_MEDICAL_REPEAT",
        "FED_FINGERPRINT_PHOTO",
        "FED_OMS_APPLY",
        "FED_DMS_CONTRACT",
        "FED_EMERGENCY_HELP",
        "FED_OMS_EAEU_EMPLOYEE"
      ]
    },
    {
      "code": "changes",
      "title": "Утрата документов, перевод и поездки",
      "step_ids": [
        "FED_MIGRATION_CARD_DUPLICATE",
        "FED_VISA_RESTORE",
        "FED_RETURN_VISA_CHECK"
      ]
    },
    {
      "code": "work",
      "title": "Действия студента при трудоустройстве",
      "step_ids": [
        "FED_WORK_STUDY_PROOF",
        "FED_WORK_STUDY_END_NOTIFY"
      ]
    },
    {
      "code": "digital",
      "title": "СНИЛС, ИНН, Госуслуги, ЕБС и связь",
      "step_ids": [
        "FED_SNILS_REGISTER",
        "FED_SNILS_UPDATE",
        "FED_SNILS_COPY",
        "FED_INN_APPLY",
        "FED_ESIA_CONFIRM",
        "FED_EBS_REGISTER",
        "FED_SIM_CONTRACT"
      ]
    },
    {
      "code": "protection",
      "title": "Проверка РКЛ и налоговые подтверждения",
      "step_ids": [
        "FED_RKL_CHECK",
        "FED_RKL_CLARIFY",
        "FED_TAX_RESIDENCE_CONFIRM"
      ]
    }
  ],
  "process_disposition": [
    {
      "process_id": "PROC_ENTRY_REGIME",
      "step_ids": [
        "FED_ENTRY_RULE_CHECK"
      ],
      "reason": "Подтверждённая часть выделена в конкретные действия; недостающие поля связаны с unresolved.",
      "unresolved_ids": [
        "UNR_ENTRY_REGIME",
        "UNR_CURRENT_EDITION"
      ]
    },
    {
      "process_id": "PROC_EDU_RECOGNITION",
      "step_ids": [
        "FED_EDU_RECOGNITION_CHECK",
        "FED_EDU_RECOGNITION_APPLY"
      ],
      "reason": "Подтверждённая часть выделена в конкретные действия; недостающие поля связаны с unresolved.",
      "unresolved_ids": [
        "UNR_EDU_RECOGNITION",
        "UNR_CURRENT_EDITION"
      ]
    },
    {
      "process_id": "PROC_EDU_LEGALIZATION",
      "step_ids": [],
      "reason": "Самостоятельный пользовательский шаг не выдан: недостаточно подтверждённого порядка либо процесс исполняет организация. Исследование и вопрос сохранены.",
      "unresolved_ids": [
        "UNR_EDU_LEGALIZATION",
        "UNR_CURRENT_EDITION"
      ]
    },
    {
      "process_id": "PROC_ADMISSION_QUOTA",
      "step_ids": [],
      "reason": "Самостоятельный пользовательский шаг не выдан: недостаточно подтверждённого порядка либо процесс исполняет организация. Исследование и вопрос сохранены.",
      "unresolved_ids": [
        "UNR_ADMISSION_QUOTA",
        "UNR_CURRENT_EDITION"
      ]
    },
    {
      "process_id": "PROC_INVITATION",
      "step_ids": [
        "FED_INVITATION_REQUEST"
      ],
      "reason": "Подтверждённая часть выделена в конкретные действия; недостающие поля связаны с unresolved.",
      "unresolved_ids": [
        "UNR_INVITATION",
        "UNR_CURRENT_EDITION"
      ]
    },
    {
      "process_id": "PROC_STUDY_VISA",
      "step_ids": [
        "FED_VISA_APPLY",
        "FED_VISA_COLLECT_ABROAD"
      ],
      "reason": "Подтверждённая часть выделена в конкретные действия; недостающие поля связаны с unresolved.",
      "unresolved_ids": [
        "UNR_STUDY_VISA",
        "UNR_CURRENT_EDITION"
      ]
    },
    {
      "process_id": "PROC_RUID",
      "step_ids": [
        "FED_RUID_STANDARD",
        "FED_RUID_EMERGENCY"
      ],
      "reason": "Подтверждённая часть выделена в конкретные действия; недостающие поля связаны с unresolved.",
      "unresolved_ids": [
        "UNR_RUID",
        "UNR_CURRENT_EDITION"
      ]
    },
    {
      "process_id": "PROC_BORDER_BIOMETRICS",
      "step_ids": [],
      "reason": "Самостоятельный пользовательский шаг не выдан: недостаточно подтверждённого порядка либо процесс исполняет организация. Исследование и вопрос сохранены.",
      "unresolved_ids": [
        "UNR_BORDER_BIOMETRICS",
        "UNR_CURRENT_EDITION"
      ]
    },
    {
      "process_id": "PROC_MIGRATION_CARD",
      "step_ids": [
        "FED_MIGRATION_CARD_ENTRY"
      ],
      "reason": "Подтверждённая часть выделена в конкретные действия; недостающие поля связаны с unresolved.",
      "unresolved_ids": [
        "UNR_MIGRATION_CARD",
        "UNR_CURRENT_EDITION"
      ]
    },
    {
      "process_id": "PROC_ARRIVAL_REGISTRATION",
      "step_ids": [
        "FED_HOST_DOCUMENTS",
        "FED_REGISTRATION_CONFIRMATION"
      ],
      "reason": "Подтверждённая часть выделена в конкретные действия; недостающие поля связаны с unresolved.",
      "unresolved_ids": [
        "UNR_ARRIVAL_REGISTRATION",
        "UNR_CURRENT_EDITION"
      ]
    },
    {
      "process_id": "PROC_HOTEL_HOSPITAL",
      "step_ids": [
        "FED_HOTEL_IDENTIFY"
      ],
      "reason": "Подтверждённая часть выделена в конкретные действия; недостающие поля связаны с unresolved.",
      "unresolved_ids": [
        "UNR_HOTEL_HOSPITAL",
        "UNR_CURRENT_EDITION"
      ]
    },
    {
      "process_id": "PROC_SELF_NOTIFICATION",
      "step_ids": [
        "FED_SELF_ARRIVAL_NOTICE"
      ],
      "reason": "Подтверждённая часть выделена в конкретные действия; недостающие поля связаны с unresolved.",
      "unresolved_ids": [
        "UNR_SELF_NOTIFICATION",
        "UNR_CURRENT_EDITION"
      ]
    },
    {
      "process_id": "PROC_AMINA",
      "step_ids": [],
      "reason": "Самостоятельный пользовательский шаг не выдан: недостаточно подтверждённого порядка либо процесс исполняет организация. Исследование и вопрос сохранены.",
      "unresolved_ids": [
        "UNR_AMINA",
        "UNR_CURRENT_EDITION"
      ]
    },
    {
      "process_id": "PROC_STAY_EXTENSION",
      "step_ids": [
        "FED_STAY_PETITION_REQUEST"
      ],
      "reason": "Подтверждённая часть выделена в конкретные действия; недостающие поля связаны с unresolved.",
      "unresolved_ids": [
        "UNR_STAY_EXTENSION",
        "UNR_CURRENT_EDITION"
      ]
    },
    {
      "process_id": "PROC_VISA_EXTENSION",
      "step_ids": [
        "FED_STUDY_VISA_EXTEND",
        "FED_STUDY_VISA_COLLECT"
      ],
      "reason": "Подтверждённая часть выделена в конкретные действия; недостающие поля связаны с unresolved.",
      "unresolved_ids": [
        "UNR_VISA_EXTENSION",
        "UNR_CURRENT_EDITION"
      ]
    },
    {
      "process_id": "PROC_MED_INITIAL",
      "step_ids": [
        "FED_MEDICAL_INITIAL"
      ],
      "reason": "Подтверждённая часть выделена в конкретные действия; недостающие поля связаны с unresolved.",
      "unresolved_ids": [
        "UNR_MED_INITIAL",
        "UNR_CURRENT_EDITION"
      ]
    },
    {
      "process_id": "PROC_MED_REPEAT",
      "step_ids": [
        "FED_MEDICAL_REPEAT"
      ],
      "reason": "Подтверждённая часть выделена в конкретные действия; недостающие поля связаны с unresolved.",
      "unresolved_ids": [
        "UNR_MED_REPEAT",
        "UNR_CURRENT_EDITION"
      ]
    },
    {
      "process_id": "PROC_FINGERPRINT",
      "step_ids": [
        "FED_FINGERPRINT_PHOTO"
      ],
      "reason": "Подтверждённая часть выделена в конкретные действия; недостающие поля связаны с unresolved.",
      "unresolved_ids": [
        "UNR_FINGERPRINT",
        "UNR_CURRENT_EDITION"
      ]
    },
    {
      "process_id": "PROC_DMS",
      "step_ids": [
        "FED_DMS_CONTRACT"
      ],
      "reason": "Подтверждённая часть выделена в конкретные действия; недостающие поля связаны с unresolved.",
      "unresolved_ids": [
        "UNR_DMS",
        "UNR_CURRENT_EDITION"
      ]
    },
    {
      "process_id": "PROC_OMS",
      "step_ids": [
        "FED_OMS_APPLY",
        "FED_OMS_EAEU_EMPLOYEE"
      ],
      "reason": "Подтверждённая часть выделена в конкретные действия; недостающие поля связаны с unresolved.",
      "unresolved_ids": [
        "UNR_OMS",
        "UNR_CURRENT_EDITION"
      ]
    },
    {
      "process_id": "PROC_EMERGENCY_CARE",
      "step_ids": [
        "FED_EMERGENCY_HELP"
      ],
      "reason": "Подтверждённая часть выделена в конкретные действия; недостающие поля связаны с unresolved.",
      "unresolved_ids": [
        "UNR_EMERGENCY_CARE",
        "UNR_CURRENT_EDITION"
      ]
    },
    {
      "process_id": "PROC_RVP",
      "step_ids": [
        "FED_RVP_APPLY"
      ],